{
  "id": "STD-UI-COM-009",
  "title": "A run's status must not collapse pipeline stages the backend already distinguishes",
  "domain": "ui",
  "level": "MUST",
  "status": "RATIFIED",
  "version": 3,
  "applies_to": [],
  "requirement": "Where a Clank's backend already preserves materially distinct pipeline-phase outcomes for an individual run (a stage field, a stage-ordered ledger, or an equivalent structured record — an ordered ledger is sufficient but NOT required: per-run, phase-attributable outcome fields such as fetch/HTTP failures, parse failures, validation outcomes, regression notes, or comparable structured state associated with a specific run qualify; aggregate or windowed counters alone do not), the primary run surface MUST NOT present a single terminal status (e.g. FAILED) in a way that erases a distinction the backend itself already tracks, when that distinction would materially change what an operator should do next. The primary run surface does not need to render every stage inline, but it MUST visibly indicate that deeper stage information exists and provide a direct, discoverable path to it — inline stage columns, an expandable row, a linked detail drawer, or a linked run-detail page all satisfy this. A page that technically contains the stage data but is not linked from, or indicated on, the primary run surface (an operator would have to already know the URL or guess) does NOT satisfy this — it is technically present but operationally absent.",
  "rationale": "Near-universal pattern across the fleet: almost every surveyed Clank records one terminal status per run (RUNNING/SUCCESS/FAILED or similar) with aggregate counters, and none except watch-clank model true pipeline-stage data at all. Where stage data does exist — watch-clank's PipelineLedger, with an explicit stage_order (discovery -> fetch -> snapshot_storage -> parsing -> normalization -> identity_resolution -> observation_creation -> family_candidate_assignment) — it is reachable only via non-nav-linked per-item drill-down pages (/watches/{id}, /correlation/{id}), not from the primary Runs page, which shows only one status badge plus funnel counts. This rule is scoped narrowly (only where stage data already exists) specifically because most Clanks have no stage model to expose, and manufacturing one would be a backend change, not a UI standard.",
  "forbidden": [
    "Inventing or requiring new backend stage-tracking where none currently exists (out of scope for this UI standard)",
    "A primary run list that shows one undifferentiated FAILED for runs that failed at materially different points, when the backend can already tell the difference",
    "Stage-level data existing on some page in the codebase with no link, indicator, or discoverable path to it from the primary run surface",
    "Treating aggregate or windowed health metrics alone as if they constituted per-run stage data — without per-run, phase-attributable state this standard's trigger is not met"
  ],
  "acceptance": [
    "If stage-level data exists in the backend for a run, the primary run surface visibly indicates it exists (not silently omits it) and provides a direct, clickable path to it",
    "Acceptable forms: inline stage columns, an expandable row, a linked detail drawer, or a linked run-detail page — an unlinked/undiscoverable route does not count",
    "The primary run list does not present one undifferentiated terminal status where the backend already distinguishes materially different failure points",
    "Applicability boundary: per-run, phase-attributable outcome fields in any record shape (flat or ledgered) count as stage-level data for this standard; aggregate or windowed metrics alone do not trigger it"
  ],
  "exceptions_allowed": true,
  "evidence": [
    { "class": "ARCHITECTURAL_INVARIANT", "source": "watch-clank/app/models/pipeline.py:73-106; app/main.py:1237-1247", "summary": "PipelineLedger with an explicit stage_order list — real stage data exists in the fleet's reference implementation." },
    { "class": "CROSS_CLANK_BEST_PRACTICE", "source": "watch-clank/app/templates/runs.html:31-51 vs app/main.py:1197-1224,1227-1265 (watch_detail.html, correlation.html)", "summary": "Primary Runs page shows only a single status badge and funnel counts; stage detail is reachable only via drill-down pages not linked from primary nav." },
    { "class": "CROSS_CLANK_BEST_PRACTICE", "source": "oem-radar/src/oem_radar/dashboard/data.py:212-228; tablet-clank/pipeline/__init__.py:11,48-56; feature-phone-clank (collector_runs schema); chinese-tech-wire/database/models.py:559-573; korean-tech-wire/dashboard.py:59-90; smartwatch-clank (runs table, healthy-only column); smartphone-clank/database/models.py:145-160; semiconductor-intelligence/semi_intel/pipeline/service.py:131,271", "summary": "Every other surveyed Clank has no true stage model — one terminal status plus aggregate counters is the norm, sometimes with a failure-type breakdown (parse vs. request error counts) but not a stage sequence." }
  ],
  "origin": "ARCHITECTURAL_INVARIANT",
  "introduced": "2026-08-30",
  "supersedes": null,
  "notes": "RATIFIED 2026-08-30 by Operator Ratification Decision 002 (decisions/0004-operator-ratification-decision-002.md), resolving the open strictness question against the permissive reading. Version 2: requirement/acceptance rewritten to require the primary run surface to visibly indicate that deeper stage data exists and provide a direct path to it — an unlinked/undiscoverable page does not satisfy this. Under this stricter reading, watch-clank's current implementation (stage data reachable only via /watches/{id} and /correlation/{id}, not linked from or indicated on the primary Runs page) does NOT conform and is a live remediation-relevant example, not an exception. Version 3 (2026-08-30): applicability boundary clarified by operator acceptance of decisions/0006-com009-equivalent-structured-record.md — an 'equivalent structured record' means per-run, phase-attributable structured outcomes regardless of record shape (a formal ordered stage ledger is sufficient but not required); aggregate/windowed counters alone do not trigger this standard. Operator principle: applicability follows the granularity of preserved evidence, not the shape of the schema. Applied consequence: smartphone-clank's flat CollectorRunRecord (http_failures/parser_failures/status/regression notes, per run) qualifies, and its verdict is FAIL — per-run detail indicated on /metrics but reachable via no route (see audits/smartphone-clank-2026-08-30.md)."
}
